{
  "version": 3,
  "updated": "2026-07-27",
  "research_cutoff": "2026-07-27",
  "metadata": {
    "project": "365Explained Frontier Model Tracker",
    "purpose": "Sourced history of frontier and significant model availability across tracked Microsoft surfaces.",
    "interpretation_rules": [
      "GitHub Models is not GitHub Copilot.",
      "Foundry catalogue availability is not Copilot Studio availability.",
      "An embedded or specialist Microsoft 365 experience is not general Copilot Chat model-picker availability.",
      "An announcement of future availability is not first availability.",
      "Current documentation proving support does not by itself prove the historical first-availability date.",
      "N/F means no reliable public first date found, not unavailable."
    ],
    "confidence_definitions": {
      "confirmed": "A primary source explicitly supports the material event date and scope.",
      "supported": "Strongly supported, but the exact first date relies on retrospective/current documentation or paired evidence."
    },
    "import_provenance": {
      "seed_archive_sha256": "7787D6528F4E97DE077B29E739BCDB565F65E6FEF55AE64B4168699F4E4BE705",
      "editorial_backlog_sha256": "1963F37DC6D18D15021ECD71E59D26A29B184CB856C7AB4D00A01F0C8A234715",
      "canonical_seed_events": 128,
      "canonical_seed_validation_items": 23,
      "published_events": 144,
      "validation_items": 36
    }
  },
  "events": [
    {
      "id": "openai-api-2020-06-11",
      "kind": "availability",
      "date": {
        "start": "2020-06-11",
        "precision": "day"
      },
      "surface_id": "openai-api",
      "model_ids": [
        "gpt-3"
      ],
      "model_claim": "family",
      "lifecycle": "ga",
      "exposure": "not_applicable",
      "confidence": "confirmed",
      "evidence_note": "OpenAI launched its API, initially giving developers access to GPT-3-era language models.",
      "sources": [
        {
          "publisher": "OpenAI",
          "title": "OpenAI API",
          "url": "https://openai.com/index/openai-api/",
          "primary": true,
          "retrieved_at": "2026-07-26",
          "source_type": "announcement"
        }
      ]
    },
    {
      "id": "microsoft-openai-gpt3-license-2020-09-22",
      "kind": "milestone",
      "date": {
        "start": "2020-09-22",
        "precision": "day"
      },
      "surface_id": "microsoft-corporate",
      "model_ids": [
        "gpt-3"
      ],
      "model_claim": "specific",
      "confidence": "confirmed",
      "evidence_note": "Microsoft announced an exclusive licence for GPT-3 technology for use in its own products and services.",
      "sources": [
        {
          "publisher": "Microsoft",
          "title": "Microsoft teams up with OpenAI to exclusively license GPT-3 language model",
          "url": "https://blogs.microsoft.com/blog/2020/09/22/microsoft-teams-up-with-openai-to-exclusively-license-gpt-3-language-model/",
          "primary": true,
          "retrieved_at": "2026-07-26",
          "source_type": "announcement"
        }
      ]
    },
    {
      "id": "github-copilot-preview-codex-2021-06-29",
      "kind": "availability",
      "date": {
        "start": "2021-06-29",
        "precision": "day"
      },
      "surface_id": "github-copilot",
      "experience_ids": [
        "code-completion"
      ],
      "model_ids": [
        "codex"
      ],
      "model_claim": "specific",
      "lifecycle": "public_preview",
      "exposure": "underlying",
      "confidence": "confirmed",
      "evidence_note": "GitHub introduced Copilot technical preview as an AI pair programmer powered by OpenAI Codex.",
      "caveat": "Published as a technical preview.",
      "relations": [
        {
          "type": "previews_for",
          "target": "github-copilot-ga-2022-06-21"
        }
      ],
      "sources": [
        {
          "publisher": "GitHub",
          "title": "Introducing GitHub Copilot: your AI pair programmer",
          "url": "https://github.blog/news-insights/product-news/introducing-github-copilot-ai-pair-programmer/",
          "primary": true,
          "retrieved_at": "2026-07-26",
          "source_type": "announcement"
        }
      ]
    },
    {
      "id": "azure-openai-preview-2021-11-02",
      "kind": "availability",
      "date": {
        "start": "2021-11-02",
        "precision": "day"
      },
      "surface_id": "azure-openai",
      "model_ids": [
        "gpt-3"
      ],
      "model_claim": "family",
      "lifecycle": "limited_preview",
      "exposure": "catalogue",
      "confidence": "confirmed",
      "evidence_note": "Microsoft introduced Azure OpenAI Service with GPT-3 access, initially by invitation.",
      "caveat": "Access was invite-only at this point.",
      "sources": [
        {
          "publisher": "Microsoft",
          "title": "New Azure OpenAI Service combines access to powerful GPT-3 language models with Azure’s enterprise capabilities",
          "url": "https://news.microsoft.com/source/features/ai/new-azure-openai-service/",
          "primary": true,
          "retrieved_at": "2026-07-26",
          "source_type": "other"
        }
      ]
    },
    {
      "id": "github-copilot-ga-2022-06-21",
      "kind": "availability",
      "date": {
        "start": "2022-06-21",
        "precision": "day"
      },
      "surface_id": "github-copilot",
      "experience_ids": [
        "code-completion"
      ],
      "model_ids": [
        "codex"
      ],
      "model_claim": "specific",
      "lifecycle": "ga",
      "exposure": "underlying",
      "confidence": "confirmed",
      "evidence_note": "GitHub Copilot became generally available to individual developers.",
      "sources": [
        {
          "publisher": "GitHub",
          "title": "GitHub Copilot is generally available to all developers",
          "url": "https://github.blog/news-insights/product-news/github-copilot-is-generally-available-to-all-developers/",
          "primary": true,
          "retrieved_at": "2026-07-26",
          "source_type": "announcement"
        }
      ]
    },
    {
      "id": "chatgpt-launch-2022-11-30",
      "kind": "availability",
      "date": {
        "start": "2022-11-30",
        "precision": "day"
      },
      "surface_id": "chatgpt",
      "model_ids": [
        "gpt-3-5"
      ],
      "model_claim": "family",
      "lifecycle": "ga",
      "exposure": "not_applicable",
      "confidence": "confirmed",
      "evidence_note": "OpenAI launched ChatGPT as a research preview using a GPT-3.5-generation model.",
      "sources": [
        {
          "publisher": "OpenAI",
          "title": "Introducing ChatGPT",
          "url": "https://openai.com/index/chatgpt/",
          "primary": true,
          "retrieved_at": "2026-07-26",
          "source_type": "announcement"
        }
      ]
    },
    {
      "id": "azure-openai-ga-2023-01-17",
      "kind": "availability",
      "date": {
        "start": "2023-01-17",
        "precision": "day"
      },
      "surface_id": "azure-openai",
      "model_ids": [
        "gpt-3-5",
        "codex",
        "dall-e-2"
      ],
      "model_claim": "family",
      "lifecycle": "ga",
      "exposure": "catalogue",
      "confidence": "confirmed",
      "evidence_note": "Azure OpenAI Service became generally available.",
      "sources": [
        {
          "publisher": "Microsoft Azure",
          "title": "General availability of Azure OpenAI Service expands access to large, advanced AI models with added enterprise benefits",
          "url": "https://azure.microsoft.com/en-us/blog/general-availability-of-azure-openai-service-expands-access-to-large-advanced-ai-models-with-added-enterprise-benefits/",
          "primary": true,
          "retrieved_at": "2026-07-26",
          "source_type": "announcement"
        }
      ]
    },
    {
      "id": "pva-generative-ai-preview-2023-03-06",
      "kind": "milestone",
      "date": {
        "start": "2023-03-06",
        "precision": "day"
      },
      "surface_id": "power-virtual-agents",
      "experience_ids": [
        "conversation-booster"
      ],
      "model_ids": [],
      "confidence": "confirmed",
      "evidence_note": "Microsoft announced Azure OpenAI-backed generative AI capabilities in Power Virtual Agents, forming the lineage later branded Copilot Studio.",
      "sources": [
        {
          "publisher": "Microsoft",
          "title": "Build solutions faster with Microsoft Power Platform and next-generation AI",
          "url": "https://www.microsoft.com/en-us/power-platform/blog/2023/03/06/build-solutions-faster-with-microsoft-power-platform-and-next-generation-ai/",
          "primary": true,
          "retrieved_at": "2026-07-26",
          "source_type": "other"
        }
      ]
    },
    {
      "id": "anthropic-claude1-2023-03-14",
      "kind": "availability",
      "date": {
        "start": "2023-03-14",
        "precision": "day"
      },
      "surface_id": "anthropic-claude",
      "model_ids": [
        "claude-1"
      ],
      "model_claim": "specific",
      "lifecycle": "ga",
      "exposure": "not_applicable",
      "confidence": "confirmed",
      "evidence_note": "Anthropic introduced Claude.",
      "sources": [
        {
          "publisher": "Anthropic",
          "title": "Introducing Claude",
          "url": "https://www.anthropic.com/news/introducing-claude",
          "primary": true,
          "retrieved_at": "2026-07-26",
          "source_type": "announcement"
        }
      ]
    },
    {
      "id": "openai-gpt4-2023-03-14",
      "kind": "availability",
      "date": {
        "start": "2023-03-14",
        "precision": "day"
      },
      "surface_id": "openai",
      "model_ids": [
        "gpt-4"
      ],
      "model_claim": "specific",
      "lifecycle": "ga",
      "exposure": "not_applicable",
      "confidence": "confirmed",